<?xml version="1.0" encoding="UTF-8"?>
<!DOCTYPE MartConfiguration SYSTEM "test.dtd">
<MartConfiguration internalName="test_file">
  <FilterDescription internalName="testLayout" type="text-entry"/>
  <Dataset internalName="test_dataset">
    <StarBase>test_starbase</StarBase>
    <PrimaryKey>test_primaryKey</PrimaryKey>
    <FilterPage internalName="testFilterPage">
      <FilterGroup internalName="testFilterGroup">
        <FilterCollection internalName="testFilterCollection">
          <FilterDescription description="For Testing Purposes Only" displayName="A TEST ID, DOESNT EXIST" field="test_id" internalName="testFilterDescription" qualifiers="in,=" tableConstraint="gene_main" type="list"></FilterDescription>
        </FilterCollection>
      </FilterGroup>
    </FilterPage>
    <AttributePage internalName="testAttributePage">
      <AttributeGroup internalName="testAttributeGroup">
        <AttributeCollection internalName="testAttributeCollection" maxSelect="1">
          <AttributeDescription description="For Testing Purposes Only" displayName="Test of a AttributeDescription" field="test_id" homepageURL="http://test.org" internalName="testAttributeDescription" linkoutURL="http://test.org?test" maxLength="1" source="test source" tableConstraint="gene_main"></AttributeDescription>
        </AttributeCollection>
      </AttributeGroup>
    </AttributePage>
  </Dataset>
</MartConfiguration>
